{
  "weapon_id": "avalanche_s5",
  "weapon_perk_pool_id": "avalanche_s5",
  "publication_status": "mechanically_validated",
  "validation_scope": "canonical-dependencies-and-perk-slots",
  "recommendations": [
    {
      "mode": "pve",
      "name": "Boss DPS",
      "sight": "sro-37-ocular",
      "magazine": "ricochet-rounds",
      "perk_3": "auto-loading-holster",
      "perk_4": "vorpal-weapon",
      "description": "```text\nBoss focused traits.\n```",
      "github_username": "rox4H",
      "issue_number": 104,
      "submitted_at": "2026-10-28T07:54:24Z",
      "publication_status": "mechanically_validated",
      "validation_scope": "canonical-dependencies-and-perk-slots",
      "published_by": "github-actions[bot]"
    },
    {
      "mode": "pve",
      "name": "PVE BOSS DAMAGE VARIANT 1",
      "sight": "spo-57-front",
      "magazine": "ricochet-rounds",
      "perk_3": "auto-loading-holster",
      "perk_4": "vorpal-weapon",
      "description": "```text\nPVE BOSS DAMAGE VARIANT 1\n```",
      "github_username": "rox4H",
      "issue_number": 120,
      "submitted_at": "2026-10-29T07:22:29Z",
      "publication_status": "mechanically_validated",
      "validation_scope": "canonical-dependencies-and-perk-slots",
      "published_by": "github-actions[bot]"
    },
    {
      "mode": "pve",
      "name": "PVE BOSS DAMAGE VARIANT 1",
      "sight": "slo-10-post",
      "magazine": "ricochet-rounds",
      "perk_3": "auto-loading-holster",
      "perk_4": "vorpal-weapon",
      "description": "```text\nPVE BOSS DAMAGE VARIANT 1\n```",
      "github_username": "rox4H",
      "issue_number": 132,
      "submitted_at": "2026-10-29T13:21:20Z",
      "publication_status": "mechanically_validated",
      "validation_scope": "canonical-dependencies-and-perk-slots",
      "published_by": "github-actions[bot]"
    }
  ],
  "published_by": "github-actions[bot]"
}
